{
  "$schema": "https://gymos.app/schemas/program.schema.json",
  "name": "PPL-UL v6",
  "description": "PPL-UL Master v6 — Updated Legs with Hip Abduction",
  "version": "6.0.0",
  "author": "GymOS (imported from PPL_UL_MASTER_v6_UPDATED_LEGS.xlsx)",
  "source": "PPL_UL_MASTER_v6_UPDATED_LEGS.xlsx",
  "goal": "hypertrophy",
  "experience_level": "intermediate",
  "split": "PPL-UL",
  "mesocycle_duration_weeks": 8,
  "deload_week": {
    "frequency_weeks": 4,
    "type": "reduced_volume",
    "description": "Every 4th week: reduce sets by 50%, maintain intensity"
  },
  "progression_strategy": {
    "primary": "double_progression_plus",
    "description": "Increase reps first, then add weight when top of rep range is hit for all sets"
  },
  "priority_muscles": [
    "quadriceps",
    "hamstrings",
    "gluteus_maximus",
    "medial_deltoid",
    "latissimus_dorsi"
  ],
  "rules": [
    "Đã cập nhật LEGS: thêm Hip Abduction",
    "Compound nghỉ 90–120s",
    "Isolation nghỉ 60–90s",
    "Đạt rep trên cùng → +2kg"
  ],
  "days": [
    {
      "name": "PUSH",
      "exercises": [
        {
          "name": "Machine Chest Press",
          "exercise_id": "chest_machine_press",
          "target_sets": 3,
          "target_reps": "8–10",
          "muscle_group": "chest"
        },
        {
          "name": "Incline DB Press",
          "exercise_id": "chest_incline_bench_press",
          "target_sets": 3,
          "target_reps": "8–10",
          "muscle_group": "chest"
        },
        {
          "name": "Pec Deck",
          "exercise_id": "chest_pec_deck",
          "target_sets": 2,
          "target_reps": "12–15",
          "muscle_group": "chest"
        },
        {
          "name": "Machine Shoulder Press",
          "exercise_id": "shoulders_machine_press",
          "target_sets": 2,
          "target_reps": "8–10",
          "muscle_group": "shoulders"
        },
        {
          "name": "Lateral Raise",
          "exercise_id": "shoulders_lateral_raise",
          "target_sets": 4,
          "target_reps": "12–15",
          "muscle_group": "shoulders"
        },
        {
          "name": "Cable Tricep Extension",
          "exercise_id": "triceps_pulldown",
          "target_sets": 3,
          "target_reps": "10–12",
          "muscle_group": "triceps"
        }
      ]
    },
    {
      "name": "PULL",
      "exercises": [
        {
          "name": "Lat Pulldown",
          "exercise_id": "back_lat_pulldown",
          "target_sets": 3,
          "target_reps": "8–10",
          "muscle_group": "back"
        },
        {
          "name": "Chest Supported Row",
          "exercise_id": "back_chest_supported_row",
          "target_sets": 3,
          "target_reps": "8–10",
          "muscle_group": "back"
        },
        {
          "name": "Seated Cable Row",
          "exercise_id": "back_seated_cable_row",
          "target_sets": 2,
          "target_reps": "10",
          "muscle_group": "back"
        },
        {
          "name": "Rear Delt Fly",
          "exercise_id": "shoulders_rear_delt_raise",
          "target_sets": 2,
          "target_reps": "12–15",
          "muscle_group": "shoulders"
        },
        {
          "name": "DB Curl",
          "exercise_id": "biceps_db_curl",
          "target_sets": 2,
          "target_reps": "10–12",
          "muscle_group": "biceps"
        },
        {
          "name": "Rope Hammer Curl",
          "exercise_id": "biceps_hammer_curl",
          "target_sets": 2,
          "target_reps": "10–12",
          "muscle_group": "biceps"
        }
      ]
    },
    {
      "name": "LEGS",
      "exercises": [
        {
          "name": "Leg Press",
          "exercise_id": "quads_leg_press",
          "target_sets": 3,
          "target_reps": "10",
          "muscle_group": "quads"
        },
        {
          "name": "Lying Leg Curl",
          "exercise_id": "hamstrings_leg_curl",
          "target_sets": 4,
          "target_reps": "10–12",
          "muscle_group": "hamstrings"
        },
        {
          "name": "Leg Extension",
          "exercise_id": "quads_leg_extension",
          "target_sets": 3,
          "target_reps": "12",
          "muscle_group": "quads"
        },
        {
          "name": "Hip Abduction Machine",
          "exercise_id": "hamstrings_adductor_machine",
          "target_sets": 3,
          "target_reps": "15–20",
          "muscle_group": "glutes"
        },
        {
          "name": "Standing Calf Raise",
          "exercise_id": "calves_standing_raise",
          "target_sets": 4,
          "target_reps": "15",
          "muscle_group": "calves"
        },
        {
          "name": "Cable Crunch",
          "exercise_id": "core_cable_crunch",
          "target_sets": 3,
          "target_reps": "12–15",
          "muscle_group": "abs"
        }
      ]
    },
    {
      "name": "UPPER",
      "exercises": [
        {
          "name": "Incline Machine Press",
          "exercise_id": "chest_incline_bench_press",
          "target_sets": 3,
          "target_reps": "8",
          "muscle_group": "chest"
        },
        {
          "name": "Lat Pulldown",
          "exercise_id": "back_lat_pulldown",
          "target_sets": 3,
          "target_reps": "8",
          "muscle_group": "back"
        },
        {
          "name": "Machine Row",
          "exercise_id": "back_chest_supported_row",
          "target_sets": 3,
          "target_reps": "10",
          "muscle_group": "back"
        },
        {
          "name": "Machine Shoulder Press",
          "exercise_id": "shoulders_machine_press",
          "target_sets": 3,
          "target_reps": "8",
          "muscle_group": "shoulders"
        },
        {
          "name": "Lateral Raise",
          "exercise_id": "shoulders_lateral_raise",
          "target_sets": 3,
          "target_reps": "15",
          "muscle_group": "shoulders"
        },
        {
          "name": "Cable Curl",
          "exercise_id": "biceps_cable_curl",
          "target_sets": 2,
          "target_reps": "12",
          "muscle_group": "biceps"
        },
        {
          "name": "Tricep Extension",
          "exercise_id": "triceps_pulldown",
          "target_sets": 2,
          "target_reps": "12",
          "muscle_group": "triceps"
        }
      ]
    },
    {
      "name": "LOWER",
      "exercises": [
        {
          "name": "Hack Squat",
          "exercise_id": "quads_hack_squat",
          "target_sets": 3,
          "target_reps": "8–10",
          "muscle_group": "quads"
        },
        {
          "name": "Lying Leg Curl",
          "exercise_id": "hamstrings_leg_curl",
          "target_sets": 4,
          "target_reps": "10–12",
          "muscle_group": "hamstrings"
        },
        {
          "name": "Leg Extension",
          "exercise_id": "quads_leg_extension",
          "target_sets": 3,
          "target_reps": "12",
          "muscle_group": "quads"
        },
        {
          "name": "Standing Calf Raise",
          "exercise_id": "calves_standing_raise",
          "target_sets": 4,
          "target_reps": "15",
          "muscle_group": "calves"
        },
        {
          "name": "Hanging Knee Raise",
          "exercise_id": "core_hanging_leg_raise",
          "target_sets": 3,
          "target_reps": "12",
          "muscle_group": "abs"
        }
      ]
    }
  ],
  "knowledge_version": "1.0.0",
  "created_at": "",
  "last_updated": "2026-07-02"
}
